"Name","Rating","Review","Custom Advertisement"
"ashleyg918","5","As a fiction novel with a fantasy genre, Harry Potter and the Sorcerer’s Stone (the Philosophers stone in the U.K.) is the beginning and first of seven novels written from author J.K. Rowling. An eleven year old boy’s adventure in beginning his journey of fulfillment and truth, Harry Potter started as an orphan known as “the one who survived” repeatedly mentioned in the novel. Harry Potter is a wizard in training who has unexplainably survived the deadly curse of which no one including his parents ever survived. Juvenile as it may seem to read of imaginary wizardry and young children’s beginning through defeating three headed dogs and observing a dreary unidentified creature feeding on a bloody unicorn, this novel is drawing and threw creative descriptive language; the reader can actually visualize the scenario in which the author exploits. As adults, some lose touch within their inner child. Creativity, imaginary figures and dreams, and reenactments were childhood tendencies that portray in the thoughts and creation of this novel. It worked. The basis behind the imaginary wizardry displayed moral values and educational learning in self-personification for children of all ages. Even though some slightly gruesome and terrifying imaginary figures could be enhanced through J.K.Rowlings figurative language, the intent is to entertain and create a fun educational reading experience for children/young adults. As though it may seem I am portraying this to only be a child’s novel that is not my intention. Just as entertaining it is to a young adult, it is just as entertaining to an adult in the mysterious thrill to uncover the truth behind Harrys survival, the symbolic significance behind the lightning bolt shaped scar on Harrys forehead, and the additional information not fully given to ponder our minds on discovering these unanswered questions. Harry Potter and the Sorcerer’s Stone as mentioned, is the beginning of Harry Potters (main character) drive to gain the knowledge of truth and unexplained self-importance and history resulting in the death of his parents. He was orphaned as an infant in the fault of a well-known and evil wizard of whom no one will mention his name (Valdimort). J.K. Rowling introduced Harry as an orphan in care of an irrational, jealous, close minded, and magic hating Aunt and Uncle accompanied by an over- bearing self-centered spoiled cousin. When reading the text, you can’t help but feel the hatred toward these so called family members, yet as continuing to read; start gaining an up most respect for Harry and the situations he endured before and after his insight on wizardry. Harry’s actions resemble a mature goal oriented and focused young man, even at age eleven, and the journey and lessons he learns with the two very loyal best friends who accompany and help guide and aid him through these journeys of truth. If it is not obvious enough, I very much enjoyed traveling through the imaginary adventure with Harry Potter. Listed on common sense media, 20 reviews on each page and nine pages long, ages ranging from 10 year old children to 45 year old parents; there is not one review rated less than 4 stars and greatly recommended for its quality to engage an audience. The Leaky Caldron a nonprofit organization website verified that this novel received the Nestlé Smarties Book Prize 1997 Gold Medal 9-11 years, FCBG Children’s Book Award 1997 Overall winner and Longer Novel Category, Birmingham Cable Children’s Book Award 1997, Young Telegraph Paperback of the Year 1998, British Book Awards 1997 Children’s Book of the Year, Sheffield Children’s Book Award 1998, Booklist Editors Choice 1998, Whitaker’s Platinum Book Award 2001, New York Public Library 100 Titles for Reading and Sharing, and the Publishers Weekly Best Book of 1998. Along with Rowling’s many achievements, what makes the Harry Potter phenomenon unique is that it is the first time in ages that a children's book, without a movie accompanying it, has generated this much popularity. Harry Potter has become as real in the minds of children and adults as that of a popular movie series. Therefore, it will be very hard for any film based upon it to compete with it. Therefore once the creation of the movie was in progress, they merely omitted detail from the book and didn’t alter the story line at all. Harry's uncle, a prominent character in the book, is given less attention in the movie than some of the other characters; and the gently satirical aspects of Hogwarts School aren't in the movie at all. We never see the ghostly history teacher who died several years back but kept on teaching, and lines like ""Professor McGonagall watched [her students] turn a mouse into a snuffbox--points were given for how pretty the snuffbox was, but taken away if it had whiskers"" I have noticed no equivalent statements in the movie. Yet, many more important aspects are still in the movie; but for more detail description and an overall great imaginary image, I recommend reading the book before watching the movie. In conclusion, overall I highly recommend reading this novel. After starting to read and feeling the anxiety over the powerful words and literary description, it keeps your mind puzzled to know more. From beginning as an orphan raised by his aunt and uncle, to finding out he is a wizard and all unanswered questions of his past, the different rules of wizardry and all the obstacles Harry and his friends face to uncover hidden secrets that lead to the truth and explanations of his existence. Sadly this is the first of seven other books and in order to enjoy more adventure, find answers to more unanswered questions and to continue the long path of events that will lead to the overall understanding of everything; you would have to finish reading the rest of the novels.","Hello ashleyg918, we see that you enjoyed reading the Harry Potter series with your child, as you gave it 5 stars! We would like to advertise this fantasy novel to you as well."
"2girlsDad","5","I read this out loud to my seven-year old daughter who is very sensitive to anything too scary. She absolutely adored the book and immediately insisted on reading book 2 and beyond (we're just starting book 3 and I came to this site to find out it would be too much for her to handle). It's suspenseful without being frightening, and humorous, especially at the beginning. The book was a good vocabulary builder and she would learn new words and sayings from it without it being overly complex or wordy.","Hello 2girlsDad, we see that you enjoyed reading the Harry Potter series with your child, as you gave it 5 stars! We would like to advertise this fantasy novel to you as well."
"Gregorius the Brown","3","No Review","Hello Gregorius the Brown, we see that you enjoyed reading the Harry Potter series with your child, as you gave it 3 stars! We would like to advertise this fantasy novel to you as well."
"RobertW","5","My daughter thinks Harry Potter is really cool and rocks. She thinks that Harry is super talented and she likes how great he is at Quidditch.","Hello RobertW, we see that you enjoyed reading the Harry Potter series with your child, as you gave it 5 stars! We would like to advertise this fantasy novel to you as well."
"magasalee","5","No Review","Hello magasalee, we see that you enjoyed reading the Harry Potter series with your child, as you gave it 5 stars! We would like to advertise this fantasy novel to you as well."
"Hillstrom","4","I think parents should focus on the message of good vs evil. It's full of fantasy and magic wich appeals to children (of all ages) but don't let over shadow the lessons kids can take away from this wonderful book. Yes it absolutely encourages kids to read more and more.","Hello Hillstrom, we see that you enjoyed reading the Harry Potter series with your child, as you gave it 4 stars! We would like to advertise this fantasy novel to you as well."
"unknown person","5","Amazing satisfying, this book is the enchanting start of this acclaimed series. A national phenomenon. Only a slight amount of violence, and parent guidance is only needed for any curse words. This book is amazing.","Hello unknown person, we see that you enjoyed reading the Harry Potter series with your child, as you gave it 5 stars! We would like to advertise this fantasy novel to you as well."
"gold2","5","No Review","Hello gold2, we see that you enjoyed reading the Harry Potter series with your child, as you gave it 5 stars! We would like to advertise this fantasy novel to you as well."
"kmarkman","5","If you want magic and friendship together then get it immediately.","Hello kmarkman, we see that you enjoyed reading the Harry Potter series with your child, as you gave it 5 stars! We would like to advertise this fantasy novel to you as well."
"Hjal","5","No Review","Hello Hjal, we see that you enjoyed reading the Harry Potter series with your child, as you gave it 5 stars! We would like to advertise this fantasy novel to you as well."
"hyumby","4","Great Book for Middle Schoolers and up!","Hello hyumby, we see that you enjoyed reading the Harry Potter series with your child, as you gave it 4 stars! We would like to advertise this fantasy novel to you as well."
"pattygb","5","This book is really good. My son was very motivated to read once he picked it up - just what a parent wants (kids excited to read!!).","Hello pattygb, we see that you enjoyed reading the Harry Potter series with your child, as you gave it 5 stars! We would like to advertise this fantasy novel to you as well."
"Kaye13","5","Start with this book and in no time your kid will be dragging you to the bookstore and begging you to buy the 700 page sequels! Captivating and inspiring story for kids and adults alike.","Hello Kaye13, we see that you enjoyed reading the Harry Potter series with your child, as you gave it 5 stars! We would like to advertise this fantasy novel to you as well."
"pebchristian","3","This first novel in the series was good but not as skillfully handled as the others. It perhaps the least violent in the entire series. But it has a good concept and good overall plot.","Hello pebchristian, we see that you enjoyed reading the Harry Potter series with your child, as you gave it 3 stars! We would like to advertise this fantasy novel to you as well."
"MKCC","5","I am 8 and love this book sooooo much I think the author who wrote this was very good at it.I also think that the movie is very good too.","Hello MKCC, we see that you enjoyed reading the Harry Potter series with your child, as you gave it 5 stars! We would like to advertise this fantasy novel to you as well."
"love2","3","tis book is a good book for kids and young teens to read. but there is some vilonce and the reading and content will probably be to much for 7 year olds and younger. but 8 year olds even though the content is suggestive and it is a little challenging it think they should try reading it. and kids that are 9 and up should definetly read it!!!!!!!","Hello love2, we see that you enjoyed reading the Harry Potter series with your child, as you gave it 3 stars! We would like to advertise this fantasy novel to you as well."
"berta_13","3","A book for the little kids with big reading, like the film it was truly as active and wonderful! with all the effects! For all ages starting at 9, but a read for all the family","Hello berta_13, we see that you enjoyed reading the Harry Potter series with your child, as you gave it 3 stars! We would like to advertise this fantasy novel to you as well."
"JulieKryger1970","4","No Review","Hello JulieKryger1970, we see that you enjoyed reading the Harry Potter series with your child, as you gave it 4 stars! We would like to advertise this fantasy novel to you as well."
"JamesRobertson","4","No Review","Hello JamesRobertson, we see that you enjoyed reading the Harry Potter series with your child, as you gave it 4 stars! We would like to advertise this fantasy novel to you as well."
"the fallen","5","i like the book but my mom is in love with the book she has it all name sumthing and she has if it invales harry potter she has to have it is scary how some people love this book ( it was a little had to fallow)","Hello the fallen, we see that you enjoyed reading the Harry Potter series with your child, as you gave it 5 stars! We would like to advertise this fantasy novel to you as well."
