"Name","Rating","Review","Custom Advertisement"
"Balgej K.","5","No Review","Hello Balgej K., we see that you enjoyed reading the Harry Potter series with your child, as you gave it 5 stars! We would like to advertise this fantasy novel to you as well."
"christineaustin100","5","This book is great! Compelling and interesting with characters you will love and root for! The only kind of inappropriate thing is when Hagrid kisses mcgonagall on the cheek because he is drunk. Also, Harry is an orphan and his parents were killed by a dark wizard which might be upsetting to young children. However, it really depends on the child. This book is full of wonder, excitement, and magic. The ending is not obvious from the very beginning like some books, which makes it an exciting page-turner. There are also great role models, loving friends, and a theme that love can conquer all evil. Please read this book! Or read it to your kid! You will not regret it! You’re never too young or old to become a potterhead!","Hello christineaustin100, we see that you enjoyed reading the Harry Potter series with your child, as you gave it 5 stars! We would like to advertise this fantasy novel to you as well."
"Victor T.","5","No Review","Hello Victor T., we see that you enjoyed reading the Harry Potter series with your child, as you gave it 5 stars! We would like to advertise this fantasy novel to you as well."
"MamaLlama1201","4","I did not read these books as an adult so I read this aloud with my 7yo for the first time and we both very much enjoyed it! There is a lot of vivid imagery and the retelling of the death of Harry's parents is a bit heavy for kids. But it's not graphic.","Hello MamaLlama1201, we see that you enjoyed reading the Harry Potter series with your child, as you gave it 4 stars! We would like to advertise this fantasy novel to you as well."
"K L.","4","No Review","Hello K L., we see that you enjoyed reading the Harry Potter series with your child, as you gave it 4 stars! We would like to advertise this fantasy novel to you as well."
"LenaH","5","Read it as a family and really enjoyed it.","Hello LenaH, we see that you enjoyed reading the Harry Potter series with your child, as you gave it 5 stars! We would like to advertise this fantasy novel to you as well."
"amomof3","5","Me and my kids love Harry Potter. It was our family read aloud where we all take turns to read a page. Even my 16 year old liked it. There is a little violence but I guess that’s life. There are great role models and messages so definitely recommend!","Hello amomof3, we see that you enjoyed reading the Harry Potter series with your child, as you gave it 5 stars! We would like to advertise this fantasy novel to you as well."
"Sean M.","5","amazing awesome and great love the characters","Hello Sean M., we see that you enjoyed reading the Harry Potter series with your child, as you gave it 5 stars! We would like to advertise this fantasy novel to you as well."
"Shelli A.","5","This is the best thing you will ever experience in ur whole entire LIFE!!!!! I don’t think it’s that scary, accept for that at the end of the movie Voldemort/Professor Quirel try’s to strangle Harry. That’s the only thing that I’m concerned about. But when you get to Ron Weasley, he does say bloody he** like fifty times in every single movie… but I think it’s totally ok! Have a nice life!","Hello Shelli A., we see that you enjoyed reading the Harry Potter series with your child, as you gave it 5 stars! We would like to advertise this fantasy novel to you as well."
"Indy S.","5","No Review","Hello Indy S., we see that you enjoyed reading the Harry Potter series with your child, as you gave it 5 stars! We would like to advertise this fantasy novel to you as well."
"Katherine R.","5","No Review","Hello Katherine R., we see that you enjoyed reading the Harry Potter series with your child, as you gave it 5 stars! We would like to advertise this fantasy novel to you as well."
"Akhil K.","5","It is one of my favorite Harry Potter books. I've read it since age 11, and it is perfect for my children, too! It's also one of the best-selling books of this series.","Hello Akhil K., we see that you enjoyed reading the Harry Potter series with your child, as you gave it 5 stars! We would like to advertise this fantasy novel to you as well."
"MamaQ","5","No Review","Hello MamaQ, we see that you enjoyed reading the Harry Potter series with your child, as you gave it 5 stars! We would like to advertise this fantasy novel to you as well."
"AlainaBa","5","I liked that they have people that are just people and don’t use magic and people who do use magic. The only thing I disliked is that it couldn’t go on forever. This book is about medium with violence. Dudley’s violence to Harry and Voldemort’s violence to Harry can be scary and you just want to read and read and read. There are a lot of rumors and not knowing and danger and mystery.","Hello AlainaBa, we see that you enjoyed reading the Harry Potter series with your child, as you gave it 5 stars! We would like to advertise this fantasy novel to you as well."
"Goodforumkvies","5","Children at around the age of 6 or 7 can keep of with everything that's going on. Consider reading it aloud with your younger kids (that haven't developed their English/reading skills). The scares could get intense but they're all quite kid friendly with no blood; the majority of the scares are caused by non-human creatures like a three headed dog, a hooded figure, a dead unicorn, etc.","Hello Goodforumkvies, we see that you enjoyed reading the Harry Potter series with your child, as you gave it 5 stars! We would like to advertise this fantasy novel to you as well."
"Cheeku2022","5","Harry Potter is a child who survived Lord Voldemort, but his parents didn’t so he was sent to live with his rotten and rude cousin. Lived with his cousin until one day a letter came, his uncle, Vernon snatched it away from Harry but soon more letters came. They had to move to a small rocky island. On their first night Hagrid a man who worked at Hogwarts came and thanks to him Harry was able to read the the letter that told him that he was invited to join the wizardry and witchcraft school. He agreed to attend Hogwarts, where he learned how to be a wizard.","Hello Cheeku2022, we see that you enjoyed reading the Harry Potter series with your child, as you gave it 5 stars! We would like to advertise this fantasy novel to you as well."
"RikkiA","4","No Review","Hello RikkiA, we see that you enjoyed reading the Harry Potter series with your child, as you gave it 4 stars! We would like to advertise this fantasy novel to you as well."
"SBBaksh","5","This book is awesome! I think its even fine for kids 7 and up. It has nothing innapropriate and is extremely interesting.","Hello SBBaksh, we see that you enjoyed reading the Harry Potter series with your child, as you gave it 5 stars! We would like to advertise this fantasy novel to you as well."
"autumnschneider78","4","The book uses the word ""damn""","Hello autumnschneider78, we see that you enjoyed reading the Harry Potter series with your child, as you gave it 4 stars! We would like to advertise this fantasy novel to you as well."
"kdsteadman","5","Hello there, today I am going to talk about why Harry Potter is so great and why you should read it. I mean it is a really good book and you might hear everybody talking about it. Maybe you have never read it because you don't think it is so good but it is. My first reason is if you're a fiction guy or girl you are in luck, because Harry Potter has wizards and witches and they are in training so think about the mistakes they make.There is a zap over here and a zap over there. And, if you're a boy and you like dragons, because did I mention there there a ton of them, and if you like screens you are going to love this because there are movies! My second reason is the setting is a castle. So if you are a girl who likes princesses you might like the sound of a castle. It is also packed with action, with fighting at the end, oh wait I'm spoiling it! Also it is so fascinating because they say if you drink unicorn blood you will live forever, but you would live a hard life, which is weird to me but maybe not for you. Another really good thing about the book is that it is really interesting because I mean how does a wand really work? How is there an invisible wall? Now these are my reasons why you should read Harry Potter. I recommend Harry Potter to anyone who likes fiction and magic. If you like it YOU BETTER GO BUY IT!","Hello kdsteadman, we see that you enjoyed reading the Harry Potter series with your child, as you gave it 5 stars! We would like to advertise this fantasy novel to you as well."
"huginbun23","5","This book is really hooking and I can read it over and over.","Hello huginbun23, we see that you enjoyed reading the Harry Potter series with your child, as you gave it 5 stars! We would like to advertise this fantasy novel to you as well."
"Lindstheteacher","4","As a child, I was not allowed to read this book due to the mentions of witchcraft. While there is magic, witches, wizards, and other fantasy creatures present in this piece of literature, the story is more a battle of good versus evil. In this book, children should be old enough to understand that some of the choices that the young protagonists make are bad. The characters disobey authority a lot. Another theme throughout this book is the theme of maltreatment. Harry Potter comes from a family who hates him. As an adult, you should discuss with your child why Harry does not think he can be happy. Other than that, it is a great read. Just know your child and discuss with them that magic is not real.","Hello Lindstheteacher, we see that you enjoyed reading the Harry Potter series with your child, as you gave it 4 stars! We would like to advertise this fantasy novel to you as well."
"Nteague","5","Perfect for kindergarten kids with a healthy dose of supervision","Hello Nteague, we see that you enjoyed reading the Harry Potter series with your child, as you gave it 5 stars! We would like to advertise this fantasy novel to you as well."
"SuperRosses","5","I think it is good but some language.","Hello SuperRosses, we see that you enjoyed reading the Harry Potter series with your child, as you gave it 5 stars! We would like to advertise this fantasy novel to you as well."
"LaurenColsby","5","If your child is ever interested in reading this book I implore you to PLEASE encourage them. My oldest daughter (9) read this book about a year ago and it completely changed her life in the reading aspect. Now because of the books she is more understanding in class and takes on bigger reading challenges. Like most kids though at first she was afraid of the size of the book but once she got into it she couldn’t stop. This book is everything a good book should be and I have read it many times myself, loving it more each time.","Hello LaurenColsby, we see that you enjoyed reading the Harry Potter series with your child, as you gave it 5 stars! We would like to advertise this fantasy novel to you as well."
"Patrick T.","5","No Review","Hello Patrick T., we see that you enjoyed reading the Harry Potter series with your child, as you gave it 5 stars! We would like to advertise this fantasy novel to you as well."
"little lamb","1","No Review","Hello little lamb, we see that you enjoyed reading the Harry Potter series with your child, as you gave it 1 stars! We would like to advertise this fantasy novel to you as well."
"Jen B.","5","No Review","Hello Jen B., we see that you enjoyed reading the Harry Potter series with your child, as you gave it 5 stars! We would like to advertise this fantasy novel to you as well."
"Keira F.","5","I really love this book. I think you should be able grow up with the character. I chose 10 because of that, and because there is a little bit of mean-ish words and violence but I think it depends on the person a lot. ( i don’t know why it says I’m a parent. I’m actually 12)","Hello Keira F., we see that you enjoyed reading the Harry Potter series with your child, as you gave it 5 stars! We would like to advertise this fantasy novel to you as well."
"Camrynn B.","5","No Review","Hello Camrynn B., we see that you enjoyed reading the Harry Potter series with your child, as you gave it 5 stars! We would like to advertise this fantasy novel to you as well."
"Zoethustra","1","Poorly written and corny, I couldn't even get through it. The characters' names were so stupid that I felt embarrassed for the author. I have no idea how such a mediocre thing could become so popular.","Hello Zoethustra, we see that you enjoyed reading the Harry Potter series with your child, as you gave it 1 stars! We would like to advertise this fantasy novel to you as well."
"Isabel F.","5","Although in some bits the book many be frieghtning for some children. I believe now that there is an illustrated edition young children will also be able to enjoy it just that much know. I started reading Harry Potter to my child right off the bat. It is scary but it is a book. I recommend the illustrated edition if reading to the child.","Hello Isabel F., we see that you enjoyed reading the Harry Potter series with your child, as you gave it 5 stars! We would like to advertise this fantasy novel to you as well."
"Mrs. C. B.","5","No Review","Hello Mrs. C. B., we see that you enjoyed reading the Harry Potter series with your child, as you gave it 5 stars! We would like to advertise this fantasy novel to you as well."
"Jason X.","5","No Review","Hello Jason X., we see that you enjoyed reading the Harry Potter series with your child, as you gave it 5 stars! We would like to advertise this fantasy novel to you as well."
"Cyndel J.","5","I gave it a 9 and up age because that is around the age I believe a lot of kids will be ready for independent reading of a story of this level. However, I am reading it to my 6 and 9 year old sons and they love it.","Hello Cyndel J., we see that you enjoyed reading the Harry Potter series with your child, as you gave it 5 stars! We would like to advertise this fantasy novel to you as well."
"The_Movie_Critic","5","This book is a great example of the underdog rising up to be the hero. Not much sex, violence, or drinking/drugs. Good storyline and will definitely capture your attention.","Hello The_Movie_Critic, we see that you enjoyed reading the Harry Potter series with your child, as you gave it 5 stars! We would like to advertise this fantasy novel to you as well."
"ben H.","5","A real page turner coudn't put it down, my son loves the all the Harry potter books , this got him into reading thanks J.K","Hello ben H., we see that you enjoyed reading the Harry Potter series with your child, as you gave it 5 stars! We would like to advertise this fantasy novel to you as well."
"Martin C.","5","I the story the plot is when Hagrid left harry next to the door with the note and told in the note Voldmort killed Mr. and Mrs. potter ans couldn't kill harry and so they could take care good care of him. The central conflict is when Harry defeated Voldemort . The theme is the triumph over good or evil . I think the book is the b est because it shows determination like no matter how small you are you can still fight a much older person than you. I gave it a five star rate because its amazing how they can tell the fantasy and its very clear every detail.","Hello Martin C., we see that you enjoyed reading the Harry Potter series with your child, as you gave it 5 stars! We would like to advertise this fantasy novel to you as well."
"scmom123","5","My son can read well for a 7-year-old but this book would be exhausting and too tedious for him to tackle on his own. However, reading this out loud to my almost 6-year-old and my 7 1/2 year old has been wonderful. Having read the books myself years ago I was looking forward to starting them. They absolutely hung on every word. I offered a tv show to them the other day and received a, ""Please Mommy, can you read Harry Potter instead?!"" Obviously there are times when a little explanation may be needed or a ""this is just pretend"" reminder given. However, my son is NOT a fan of scary movies or stories and he didn't have a problem with the story. The wonderful thing about the book is that the scarier moments aren't thrown at the reader quickly or bluntly. There is build up that lets the kids know something is coming and things aren't too graphic. Also, and in my opinion most importantly, is that there is no senseless violence. Any violence or fighting serves a purpose for the greater good vs evil tale. I am truly looking forward to reading all the books - we will take each one as it comes and decide if they are right for the kids' ages. I caution parents against waiting too long for these books as the value will be diminished when they eventually stumble across the movies or other spoilers among their friends. Wouldn't it be a shame to ruin the experience of this many large books that they would otherwise relish?","Hello scmom123, we see that you enjoyed reading the Harry Potter series with your child, as you gave it 5 stars! We would like to advertise this fantasy novel to you as well."
"Mr.Sager","5","An unwanted boy, with no clue about his past or family, is thrust into a world of magic, witches, and wizards. Harry Potter learns about a rich new world that he is a very important part of. Along the way, he meets some new friends and finds himself caught in the middle of a struggle that explains who he really is. Harry struggles with evil powers beyond his understanding, while he believes one of the teachers from his school, Hogwarts, is out to get him. Along the way Harry and his new found friends, Hermione and Ron demonstrate courage, wits, and determination against all odds. We could learn these attributes will help us overcome the greatest of adversity. This book is amazing! I highly recommend it to all readers, even if you are not a fan of fantasy. J.K. Rowling writes this first book with very Dahl-like flare and pacing. Like Dahl, there is an underlying darkness and humor that gives this book some great character. How often does a tormenting older cousin get cursed with a pig's tail? Or when you pick up a jelly bean it has as much of a chance tasting like vomit as is it does apple? This book shows the value of hard work, good thinking, and taking risks for the benefit of others. All of these are values I would love my kids and students to have. These values are portrayed by the protagonist, Harry Potter, and his partners in crime, Hermione Granger, and Ron Weasley. Overall an amazing book!","Hello Mr.Sager, we see that you enjoyed reading the Harry Potter series with your child, as you gave it 5 stars! We would like to advertise this fantasy novel to you as well."
"april.george","5","As a children's librarian, I always seem to steer the kids towards Harry Potter if they like series and magic. I read all seven books back to back and could not put them down. Kids around 10-12 will enjoy reading about kids that are the same age and going through some of the same problems such as bullies, feelings of loneliness or feeling they don't belong. Hopefully they follow through with the series and into the darker themes of the last four books. I enjoy a good Good vs. Evil story and this is just that.","Hello april.george, we see that you enjoyed reading the Harry Potter series with your child, as you gave it 5 stars! We would like to advertise this fantasy novel to you as well."
"Felipe Carmona","4","What this story is about is a Harry Potter who had lived his life with his miserable aunt and uncle, and annoying son. The boy didn't know anything about spells, help hatch an egg, and flying a broom. Well all that is about to change when a letter comes to Harry by a animal. That letter was an invitation of a place that is really incredible. So from there he will meet friend and many other things he didn't know what to do. One of the conflict in this book is Harry and his friends trying to stop an evil presence from getting something really powerful. One theme about this book is danger. danger because of how harry and his friends had to go places not even a adult would go. I say this is a good book because i had seen the movie and all i say i found more details in the book that didn't show in the movie. I would recommend this book because to other people cause if looking for dangerous obstacles this is the book.","Hello Felipe Carmona, we see that you enjoyed reading the Harry Potter series with your child, as you gave it 4 stars! We would like to advertise this fantasy novel to you as well."
"Theminecraftingreaper","5","I think this book is awesome becuse it supports the story like its on a balenceing act. Bye","Hello Theminecraftingreaper, we see that you enjoyed reading the Harry Potter series with your child, as you gave it 5 stars! We would like to advertise this fantasy novel to you as well."
"Kristina Le Nguyen","4","My daughter loves reading Harry Potter because she can imagine as if she was there. I know some families think it is bad but it is one of the bestseller in New York times. The violence is appropriate for the kids 8 and up. This story has great imagery and language. If you don't believe me, read it for yourself :)","Hello Kristina Le Nguyen, we see that you enjoyed reading the Harry Potter series with your child, as you gave it 4 stars! We would like to advertise this fantasy novel to you as well."
"dgjd","4","Read this with my my 8 yr old son. He loved the story and even read it went we weren't looking. There were a couple of nights of nightmares (after the drinking of unicorn blood). Had to explain what it meant when Hagrid was ""drunk"" and made bad choices. The story ends sweetly, if not a bit sad. We promised the movie after we finished the book and I must say that I am a bit nervous.","Hello dgjd, we see that you enjoyed reading the Harry Potter series with your child, as you gave it 4 stars! We would like to advertise this fantasy novel to you as well."
"Puddleglum","1","This book is completely overrated. The poorly written start to a corny, average series that somehow got exalted to the level of actual great literature like The Chronicles of Narnia (which goes without saying is an infinitely better series by an infinitely better writer). Specifically, the writing is awful, the story is average, the character names are so corny they make you feel embarrassed to say them aloud. It's impossible to imagine that anyone over 8 years old could find this enjoyable. Basically, it's the Britney Spears of books- popular yet highly overrated.","Hello Puddleglum, we see that you enjoyed reading the Harry Potter series with your child, as you gave it 1 stars! We would like to advertise this fantasy novel to you as well."
